{
  "edition": "2026-10-15.2",
  "built_at": "2026-10-15T14:43:15.637Z",
  "source": {
    "database_id": "17b99d1873384a1bb688c0075de45f78",
    "data_source_id": "2b06fc1239c540da976da76a8e935e57",
    "read_via": "rest",
    "read_at": "2026-10-15T14:43:15.637Z"
  },
  "tags": [
    {
      "name": "Context-dependent",
      "page_id": "3fa273e2-14eb-81b4-ac39-c90a1930a62e",
      "category": "Quality",
      "polarity": "Issue",
      "status": "Verified",
      "counterpart": "Self-contained",
      "description": "A claim whose meaning depends on something introduced outside it: a pronoun or a definite reference (\"the initiative\", \"the vulnerabilities\", \"recent actions\") that no name inside the claim resolves, so a reader cannot tell what it points at.",
      "when_to_use": "1. A pronoun with no antecedent inside the claim (\"He said ...\", \"its predecessor\", \"they announced\") makes the claim Context-dependent.\n2. A definite reference that needs an outside antecedent to identify it (\"the vulnerabilities\", \"the discussions\", \"the recording\", \"the settlement terms\", \"the legal dispute\", \"recent actions\") makes the claim Context-dependent, even when other entities in the claim are named.\n3. A descriptive definite that names a kind of thing but not which one (\"the Bitcoin ETF\", \"the major-bank stablecoin consortium\", \"the open-access version\", \"the infrastructure\", \"the new model\") makes the claim Context-dependent: the reader must already know which ETF, consortium, version or product is meant. Applies to countable things, not to abstract or mass nouns (\"the regulatory clearance\", \"the market\").\n4. Test: could a reader who sees only this sentence say which specific thing each definite reference points at? If any answer is no, tag Context-dependent.\n5. Do not use for indefinites, time expressions, generics, or definites the claim itself resolves.",
      "rules": [
        {
          "n": 1,
          "text": "A pronoun with no antecedent inside the claim (\"He said ...\", \"its predecessor\", \"they announced\") makes the claim Context-dependent."
        },
        {
          "n": 2,
          "text": "A definite reference that needs an outside antecedent to identify it (\"the vulnerabilities\", \"the discussions\", \"the recording\", \"the settlement terms\", \"the legal dispute\", \"recent actions\") makes the claim Context-dependent, even when other entities in the claim are named."
        },
        {
          "n": 3,
          "text": "A descriptive definite that names a kind of thing but not which one (\"the Bitcoin ETF\", \"the major-bank stablecoin consortium\", \"the open-access version\", \"the infrastructure\", \"the new model\") makes the claim Context-dependent: the reader must already know which ETF, consortium, version or product is meant. Applies to countable things, not to abstract or mass nouns (\"the regulatory clearance\", \"the market\")."
        },
        {
          "n": 4,
          "text": "Test: could a reader who sees only this sentence say which specific thing each definite reference points at? If any answer is no, tag Context-dependent."
        },
        {
          "n": 5,
          "text": "Do not use for indefinites, time expressions, generics, or definites the claim itself resolves."
        }
      ],
      "example_claims": [
        "Open AI's initiative went well with the target group.",
        "He said the new model outperforms its predecessor.",
        "The company's revenue grew 40% after the launch.",
        "Core Lightning developers are keeping the technical details of the vulnerabilities under embargo for two weeks.",
        "The Commodity Futures Trading Commission did not comment specifically on the discussions.",
        "The Bitcoin ETF successfully integrated Bitcoin into traditional brokerage accounts."
      ],
      "geo_status": "To be created",
      "geo_tag_id": null,
      "verified_on": "2026-09-10",
      "evidence": "https://app.notion.com/3cf273e214eb81f2a815e7a751512a07",
      "work_tags": [
        "Pipeline benchmark check",
        "Issue"
      ],
      "capability": "text",
      "judged": true,
      "tag_hash": "sha256:af49109ca891789f"
    },
    {
      "name": "Exact duplicate",
      "page_id": "3fa273e2-14eb-819b-8bcb-e51bbc9ab025",
      "category": null,
      "polarity": null,
      "status": null,
      "counterpart": null,
      "description": "Exactly the same claim already exists in one of the canonical spaces",
      "when_to_use": "",
      "rules": [],
      "example_claims": [],
      "geo_status": null,
      "geo_tag_id": null,
      "verified_on": null,
      "evidence": null,
      "work_tags": [
        "Issue"
      ],
      "capability": "corpus",
      "judged": false,
      "tag_hash": "sha256:33f5bfb52a305685"
    },
    {
      "name": "Factually challenged",
      "page_id": "3fa273e2-14eb-81f2-a095-f23bd85e7e53",
      "category": "Quality",
      "polarity": "Issue",
      "status": "Proposed",
      "counterpart": null,
      "description": "A claim that is contradicted or disputed by the evidence — its own attached source, or another source in the space, asserts the opposite of or materially undercuts the claim. Distinct from Improperly sourced (source simply does not cover the claim) — here the evidence actively pushes against it.",
      "when_to_use": "Requires reading the source and, ideally, the wider record (source-reading tag); coverage-limited.\n1. Fires when evidence contradicts or materially disputes the claim's assertion.\n2. Does not fire merely because a source fails to support the claim (that is Improperly sourced).\n3. NOT-CHECKABLE where no source is attached or the host blocks fetching.\n4. STILL PROPOSED: on the 10 Sep fresh sample this tag fired on zero factual claims (curated claims are rarely contradicted by their own sources), so the definition is not yet exercised on a real positive case. Keep; validate on a claim that is genuinely contradicted before marking Verified.",
      "rules": [
        {
          "n": 1,
          "text": "Fires when evidence contradicts or materially disputes the claim's assertion."
        },
        {
          "n": 2,
          "text": "Does not fire merely because a source fails to support the claim (that is Improperly sourced)."
        },
        {
          "n": 3,
          "text": "NOT-CHECKABLE where no source is attached or the host blocks fetching."
        },
        {
          "n": 4,
          "text": "STILL PROPOSED: on the 10 Sep fresh sample this tag fired on zero factual claims (curated claims are rarely contradicted by their own sources), so the definition is not yet exercised on a real positive case. Keep; validate on a claim that is genuinely contradicted before marking Verified."
        }
      ],
      "example_claims": [],
      "geo_status": "To be created",
      "geo_tag_id": null,
      "verified_on": null,
      "evidence": null,
      "work_tags": [
        "Issue"
      ],
      "capability": "source",
      "judged": false,
      "tag_hash": "sha256:a71dc3170b63686b"
    },
    {
      "name": "Improper capitalization",
      "page_id": "3fa273e2-14eb-813f-8895-d5dffb1b09e5",
      "category": "Quality",
      "polarity": "Issue",
      "status": "Proposed",
      "counterpart": null,
      "description": "A claim whose text breaks sentence casing: mid-sentence capitals on words that are not proper nouns, proper nouns left lowercase, or all-caps emphasis.",
      "when_to_use": "",
      "rules": [],
      "example_claims": [
        "peace Is Better than War.",
        "The Company Announced Record Profits In The Third Quarter.",
        "bitcoin's supply is CAPPED at 21 million coins."
      ],
      "geo_status": null,
      "geo_tag_id": null,
      "verified_on": null,
      "evidence": null,
      "work_tags": [
        "Issue"
      ],
      "capability": "text",
      "judged": false,
      "tag_hash": "sha256:6e5514d1f3545011"
    },
    {
      "name": "Improperly sourced",
      "page_id": "3fa273e2-14eb-81a2-b0d6-d13094df2a1b",
      "category": "Quality",
      "polarity": "Issue",
      "status": "Verified",
      "counterpart": null,
      "description": "A claim whose attached source, when read, does not actually support the claim's assertion — the source is present but the specific figure, event, or statement the claim makes is absent from or not established by it. Distinct from Unsourced, where no source is attached at all.",
      "when_to_use": "Requires reading the source (source-reading tag), so it is coverage-limited, not a text-only judgment.\n1. Fires when the source is fetched and read and does not carry the claim's specific assertion (\"the price points the claim cites are not in the article\", \"the country coverage the claim states is not mentioned\").\n2. Does not fire when the source supports the claim's core assertion even if a minor secondary detail is unstated (treat that as supported).\n3. No attached source is Unsourced. An attached source that cannot be read is . Access failure alone never justifies Improperly sourced, Factually challenged, Unverified, or a contradiction verdict; never report unread content as a pass.\n4. Applies to factual claims; an opinion has no supporting source in the ordinary sense.\n5. Validated 10 Sep on a source-reading pass over the fresh sample: 71% of sourced claims were checkable; the tag fired correctly on every checkable mismatch.",
      "rules": [
        {
          "n": 1,
          "text": "Fires when the source is fetched and read and does not carry the claim's specific assertion (\"the price points the claim cites are not in the article\", \"the country coverage the claim states is not mentioned\")."
        },
        {
          "n": 2,